COMMENT_ID,AUTHOR,DATE,CONTENT
_2viQ_Qnc6-jidHqOHj6hf4XnhflHNGicw4dL1vZRvQ,DizzyDank314,2013-09-07T20:04:51.947000,ｈｔｔｐ://ｗｗｗ.ｅｂａｙ.ｃｏｍ/ｕｓｒ/ｓｈｏｅｃｏｌｌｅｃｔｏｒ314
_2viQ_Qnc69hcZfDZYAej5tFyv6a7kX1xwJGCG1T3qY,dili bair,2013-09-06T14:02:25.579000,Recommend:  Apple iPad 4th Gen 32GB Unlocked Wi-Fi+4G 9.7in White Price:$390  Apple iPhone 5 (Latest Model) - 32GB - Black Price:$385  Samsung Galaxy S4 S IV 4 with 16GB New White Price:$360  Sony 60-inch 3D LED HDTV Price:$510  All-in-One PCs: Apple MacBook Pro: Apple MacBook Air Price:$320  Camera :Nikon D90 SLR Camera /18-55mm /55-200mm 32GB  Price:$390   Ultrabooks: SONY VAIO Pro 13 Intel Core i5 4GB 128GB Price:$515  +++++++++++++++    Purchase online Website is:  Taaee.com
_2viQ_Qnc68RkAwC42s4YBDdCJYELSb6UiuZri58Kn0,Charanjeet Singh,2013-09-06T12:13:12.642000,&quot;HELP THE HUMANITY WITH YOUR SIGN IN TO THIS LINK WITH YOUR WHOLEHEARTED SUPPORT IF YOU SAY &quot;NO&quot; TO DISCRIMINATION. “UNITED WE STAND “  WE WILL BRING THE CHANGE TOGETHER.  IMPOSSIBLE ITSELF SAYS I  M  POSSIBLE&quot;  YOU ARE THE WINNERS OF MY SUCCESS!CHEERS TO ALL MY LOVING BROTHERS AND SISTERS !  PLEASE SHARE THIS LINK ON FACEBOOK TO SUPPORT AGAINST DISCRIMINATION.  tinyurl(dot)com(slash)mxh2y77  FEAR NONE BUT GOD !!!
_2viQ_Qnc686iGqhAHKEeclAngy8MjvOxAo1hFpatHc,Krystian Konrad Moreński,2013-09-06T09:38:13.854000,"Part 5. Comforter of the afflicted, pray for us Help of Christians, pray for us Queen of Angels, pray for us Queen of Patriarchs, pray for us Queen of Prophets, pray for us Queen of Apostles, pray for us Queen of Martyrs, pray for us Queen of Confessors, pray for us Queen of Virgins, pray for us Queen of all Saints, pray for us Queen conceived without original sin, pray for us Queen of the most holy Rosary, pray for us Queen of the family, pray for us Queen of peace, pray for us "
_2viQ_Qnc6_38op-kBrdA4xwd0KSYefHqdbeuljSgzM,Krystian Konrad Moreński,2013-09-06T09:36:48.076000,"Part 2. Holy Mary, pray for us Holy Mother of God, pray for us Holy Virgin of virgins, pray for us Mother of Christ, pray for us Mother of divine grace, pray for us Mother most pure, pray for us Mother most chaste, pray for us Mother inviolate, pray for us Mother undefiled, pray for us Mother most amiable, pray for us Mother most admirable, pray for us Mother of good counsel, pray for us Mother of our Creator, pray for us Mother of our Redeemer, pray for us "
_2viQ_Qnc6_FlLJN0izQaKVQNe6LGDmPZMmkVDjjymE,Neeru bala,2013-09-05T23:07:09.056000,Hi.. Everyone.. If anyone after real online work. I can help u. Earn lots of money. It&#39;s fun. It&#39;s real and affiliated company.. U not think u r working. It&#39;s easy and enjoyable. For more info contact me .. Neeru105@ gmail.com
_2viQ_Qnc6-oktCjZuAEscq8DxT2RHFY1nfSS_hCWf0,Wafence,2013-09-04T19:16:44.109000,"Hey Youtubers and All Music lover&#39;s, Guess most of you all skip these comments, but for you who is still reading this, thanks ! I dont have any money for advertisiments, no chance of getting heard, nothing. All that&#39;s left is spam, sorry. Im 17, Rapper/Singer from Estonia. Please listen my new cover on my account. You wont regret it. Give me just a chance, please. Take half a second of your life and thumb this comment up. It will maybe change my life, for real. Thank you Wafence "
_2viQ_Qnc6-8fXmwJsxpt64D862oCsb0cCfnoF_7Pwg,david rodriguez,2013-09-04T04:08:26.821000,do you want to make some easy money? check out my page tvcmcadavid.weebly . com dont miss out on this opportunity give thumbs up i would  apprecitate it.
_2viQ_Qnc6-r7fiKCYAGotgCULCIx695QCHaAZDKHBM,Tiffanythebest,2013-09-02T19:42:46.640000,"PLEASE CHECK OUT THIS VIDEO CALLED &quot;WE LOVE MIND MASTER IT&quot;, THANK U :)"
_2viQ_Qnc69wycunZGebHhH3CnhNYYLjUzHrnXdzkV8,How To Advertise On Facebook,2013-09-01T16:16:00.721000,WAYS TO MAKE MONEY 50k Per Month Search google Now &gt;&gt; 9nl.me/make-money-without-investment-1
_2viQ_Qnc6_JXdgRpQbBADKUYa1ESkXLxO1oW_ouaxU,How To Make Money On Youtube,2013-09-01T10:24:20.112000,Meet The Richest Online Marketer  NOW CLICK : bit.ly/make-money-without-adroid
_2viQ_Qnc6-76PJqtBpzwmOHbogHlzWG9RSSpe-Kr1s,Maika Kate Mish Linn,2013-08-31T08:59:35.957000,How did you know that people makes another account just for subscribing itself and liking??? :)
_2viQ_Qnc69AVbPU2gXuoLiAOr6muFqsr7sm17CjhX4,Maika Kate Mish Linn,2013-08-31T08:56:12.507000,:) I&#39;ll subscribe to you. You look Nice :)
_2viQ_Qnc69WextJrbKBgZtDWQiRWlkxS317fouQMYc,Chris Boatsome,2013-08-30T22:41:51.117000,Hey dickwad - we&#39;re all africans. The colour of your skin just tells us something about how long ago your ancestors left Africa.   Check out Baba Brinkman - he has a song called &quot;I&#39;m A African&quot;   Go learn something.
_2viQ_Qnc69hCwlRZTPP7JejZgoroMu8egbziE1hSAc,Mini Mus,2013-08-29T12:28:03.233000,WOW muslims are really egoistic..... 23% of the World population and not in this video or donating 1 dollar to the poor ones in Africa :( shame on those terrorist muslims
_2viQ_Qnc68cUterDmjc7m6MyHkz-ADLt28bgxo9TJE,RapStarz Coleman,2013-08-28T19:05:48.998000,Wats Good Go Check Out My Music On Da Channel Ik Yall Got me
_2viQ_Qnc6-jJD3XsdtbSW-9MCGB_Xp0nl2NhTBgdGo,RapStarz Coleman,2013-08-27T21:12:40.752000,I Know Y&#39;all Can Check Out Amy Music Because Yall Got Me Go To Da Channel
_2viQ_Qnc6-k-Ldaj1pejT7IsYIELp1Npwz5tQAkuX0,Northland Paranormal Society,2013-08-27T13:35:06.557000,Northland Paranormal Society is now on YouTube! Check out our channel of real Paranormal evidence!! facebook/ Northland Paranormal Society!!!
_2viQ_Qnc6_m4670hGGDwGjYreYnRR8359YYmuS_lDA,Adam Whitney,2013-08-26T05:24:14.644000,"Hello everyone :) I know most of you probably pass up these kind of comments, but for those who are still reading this, thanks! I don’t have any money for advertisements, no chance of getting heard, nothing. I live in such a small town... If this comes off as spam, sorry. I’m an instrumental songwriter from Columbus, Mississippi. Please go to my channel and check out my original music. It would be highly appreciated if you thumbs up this comment so my music can be heard! Thank you, Adam Whitney "
_2viQ_Qnc68kPR6lRkhBHXUX2dGt04-4RgzINpv8Yhk,Ando Nesia - | MC | Music Producer,2013-08-25T04:22:28.183000,SO THEN HOW ARE YOU GOING TO CALL YOURSELF A INSTRUMENTAL SONGWRITER IF THERES NO SINGING THERES NO SONG TO WRITE!?!?! LOL.   YOU GOT ALOT TO LEARN KID BUT HEY DON&#39;T FORGET TO SUBSCRIBE!
_2viQ_Qnc6-NqqHR40AwZGnQV7in6y6YrSbMW9wRZXM,Adam Whitney,2013-08-25T03:56:24.363000,"Hello everyone :) I know most of you probably pass up these kind of comments, but for those who are still reading this, thanks! I don’t have any money for advertisements, no chance of getting heard, nothing. I live in such a small town... If this comes off as spam, sorry. I’m an instrumental songwriter from Columbus, Mississippi. Please go to my channel and check out my original music. It would be highly appreciated if you thumbs up this comment so my music can be heard! Thank you, Adam Whitney "
_2viQ_Qnc6-lW0XpQ5szMbbKcq0fuK2p4lDhPbQpGn0,CC FootballWorld,2013-08-24T12:41:23.384000,Please go in and see our Channel and subscribe :-). It would be Nice mate.
_2viQ_Qnc6-m9RqGULP5B8P1SH2WqvKu3TnN7rBk2CI,henry Richardson,2013-08-24T05:53:21.519000,wanna earn money online without investment.....just visit this link .....therglove.blogspot.in/2013/08/blog-post_10.html
_2viQ_Qnc6_hoPuz8gsl9ZFXFZGPESkLzYU9REwL880,Adam Whitney,2013-08-24T03:05:10.278000,"Hello everyone :) I know most of you probably pass up these kind of comments, but for those who are still reading this, thanks! I don’t have any money for advertisements, no chance of getting heard, nothing. I live in such a small town... If this comes off as spam, sorry. I’m an instrumental songwriter from Columbus, Mississippi. Please go to my channel and check out my original music. It would be highly appreciated if you thumbs up this comment so my music can be heard! Thank you, Adam Whitney "
_2viQ_Qnc6_yLBNpqStGB5UF3nD3razd5EYm60rdOKs,OriginalVines Best,2013-08-21T20:02:33.102000,CHECK OUT THE DUBSTEP VERSION
_2viQ_Qnc68ohvE0UyLK_gdOAe__2iDVi8CqVB97qeA,How To Make Money On The Internet,2013-08-21T14:18:11.087000,i can to make money
_2viQ_Qnc6_nI97BKqkdeX9pbSkcDCWrg5cDb74C7kk,Gotcha Laughs,2013-08-19T17:21:29.806000,Wanna Laugh??? Please SUBSCRIBE to our channel!!!
_2viQ_Qnc6_fFzltk8kvomVzwfkCdIZApG5fa2-gZRw,Diaz Katherine,2013-08-17T21:11:39.761000,Earn money for being online with 0 efforts!    bit.ly\14gKvDo
_2viQ_Qnc6_HD2WpfyqvoRqTXGoLMA_zfTPGbWKrYyw,Bernice Anne,2013-08-16T18:33:18.009000,"Could you please check out my covers on my channel? I do covers like Adele, Kodaline, Imagine Dragons...and more. Please if you could spare a few minutes,  could you have a listen to one or two of my covers , Feel free to comment and subscribe :) Thank you! "
_2viQ_Qnc68ked0J7OAfephXPfR-pvW7HiuIC5ZRduI,macgyver16,2013-08-16T14:07:09.668000,adf.ly /KlD3Y
_2viQ_Qnc6-hMCH52bsWm38Ur7cdAPSdC3SmpC0-9YM,Fiddle Me Silly,2013-08-16T12:06:30.190000,Check out  these Irish guys cover  of Avicii&#39;s  Wake Me Up!  Just search...  &quot;wake me up Fiddle Me Silly&quot; Worth a listen  for the gorgeous fiddle player!
_2viQ_Qnc6-MfwtDpLuGhWQ2o-4TN6bmxidyzSzQuc0,DynamicDesignStudios,2013-08-15T22:17:46.329000,"Hello everyone :) I know most of you probably pass up these kind of comments, but for those who are still reading this, thanks! I don’t have any money for advertisements, no chance of getting heard, nothing... If this comes off as spam, sorry. I am a video animator, just trying to make it up into the video animation industry. Please give me the chance to prove myself to you. Please visit my channel, subscribe if you like and thumb this comment up, so everyone can see! Thank You! "
_2viQ_Qnc69datZTHIa2E_Ejo2gIk6WmZJJUiCSMLTw,DynamicDesignStudios,2013-08-15T19:58:19.748000,"Hello everyone :) I know most of you probably pass up these kind of comments, but for those who are still reading this, thanks! I don’t have any money for advertisements, no chance of getting heard, nothing... If this comes off as spam, sorry. I am a video animator, just trying to make it up into the video animation industry. Please give me the chance to prove myself to you. Please visit my channel, subscribe if you like and thumb this comment up, so everyone can see! Thank You! "
_2viQ_Qnc6_Zg0GECxJ4iGuOCFBrzjOBZguGqOhU5ms,DJ ROY,2013-08-14T21:07:42.306000,"Hey youtubers... I really appreciate all of you who took the time, to read this, I am just a 19 year old boy who wants to be a successful musician in the music world. I dont have any money to advertise my channel, If you could just visit my channel, comment on my video or subscribe, that would be great.... It will only be few seconds of your life..... Thank u to all the people who just gave me a chance l really appreciate it  "
_2viQ_Qnc69swE48B0wgwJijgdZ2KbSVUK5TSpqoYDg,Mazacar Cfc,2013-08-13T20:01:56.702000,subscribe to my pagee please.
_2viQ_Qnc69TuQDH0yVDsXPiyJCNNBrDiYhDY66Xu8g,Stanša Matej,2013-08-13T19:18:54.893000,please subscribe to my page. thanks.
_2viQ_Qnc6870xv47G-__kc0IimrvnGFcLXaLnJsiFE,Edward Wright,2013-08-11T05:23:08.533000,"Hey, hit this shit up while yall can, they killed the versace remix. Just type in CGE &quot;Versace Freestyle (Get Money)&quot; Shot by Ja-Wan Gardner and help them reach 1 million views."
_2viQ_Qnc6-qc6sKOH4U0o8eIL4tVjojc-DyDYkkvWk,Comedy Recipe,2013-08-11T03:40:42.801000,"Hey guys and girls check out Comedy Recipe for hilarious you tube videos, pranks, and crank calls!"
_2viQ_Qnc6978LweIjWZsjP3qK1bgFSYyumKWxPsq_I,Titan,2013-08-08T21:16:25.626000,"Subscribe me, I will? subscribe you back!!!"
_2viQ_Qnc6812QtCcbHa3ZgmjznXhr0Ar324LJpkSHE,Titan,2013-08-08T21:15:36.040000,"Subscribe me, I will? subscribe you back!!!"
_2viQ_Qnc6_QPhRwA4ZFbviXqXHvKyKJb7UivUZFUH0,TheEpicMixx':)x,2013-08-08T14:54:45.831000,Please.. Check my channel out:) I subscribe back..;)
_2viQ_Qnc69bp77hGJ6em0Gm1Fg_TLmNoUuS_ydlofg,TheEpicMixx':)x,2013-08-08T13:34:40.655000,I really ask nicely to view my vids:) I subscribe back..
_2viQ_Qnc6_Hcona9vbTbZqnb5SyyHKi7PxVC-KkfTY,ricky swaggz,2013-08-07T23:40:12.225000,******* Facebook is LAME and so 2004! Check out ------------ swagFriends com Make thousands of cool new friends everyday! Join this new movement!
_2viQ_Qnc69r15LuL8TDbisnTJ_hf5RfcyJAyoMC5eo,Hidden Love,2013-08-06T11:40:05.581000,Hi. Check out and share our songs.
_2viQ_Qnc6-h3o48aXYmI_xInBcH9saCmEK627IQm68,Tim Marrotte,2013-08-05T12:25:21.682000,CHECK OUT partyman318 FR GOOD TUNEZ!! :D
_2viQ_Qnc6-LyNEXRld9VERRpRICrMPNxpnGjL8ZsF4,DJ ROY,2013-08-02T21:02:09.931000,"Hey youtubers... I really appreciate all of you who took the time, to read this, I am just a 19 year old boy who wants to be a successful musician in the music world. I dont have any money to advertise my channel, If you could just visit my channel, comment on my video or subscribe, that would be great.... It will only be few seconds of your life..... Thank u to all the people who just gave me a chance l really appreciate it  "
_2viQ_Qnc69zyetF6GsHRzYGyXl4u5kg0Sm-nP-pupI,Shadrach Grentz,2013-08-02T03:15:46.914000,"Hey Music Fans I really appreciate any of you who will take the time to read this, and check my music out! I&#39;m just a 15 year old boy DREAMING of being a successful MUSICIAN in the music world. I do lots of covers, and piano covers. But I don&#39;t have money to advertise. A simple thumbs up to my comment, a comment on my videos or a SUBSCRIPTION would be a step forward! It will only be a few seconds of your life that you won&#39;t regret!!! Thank u to all the people who just give me a chance! :)"
_2viQ_Qnc699u36gNm3NRoq1quIaJWRNrftGEEZM3J4,Shadrach Grentz,2013-08-01T21:43:52.122000,"Hey Music Fans I really appreciate any of you who will take the time to read this, and check my music out! I&#39;m just a 15 year old boy DREAMING of being a successful MUSICIAN in the music world. I do lots of covers, and piano covers. But I don&#39;t have money to advertise. A simple thumbs up to my comment, a comment on my videos or a SUBSCRIPTION would be a step forward! It will only be a few seconds of your life that you won&#39;t regret!!! Thank u to all the people who just give me a chance! :) "
_2viQ_Qnc68LqKGb40V2ImKQYcp1ZqpHrCCMFqMCcA4,Shadrach Grentz,2013-08-01T20:39:15.325000,"Hey Music Fans I really appreciate any of you who will take the time to read this, and check my music out! I&#39;m just a 15 year old boy DREAMING of being a successful MUSICIAN in the music world. I do lots of covers, and piano covers. But I don&#39;t have money to advertise. A simple thumbs up to my comment, a comment on my videos or a SUBSCRIPTION would be a step forward! It will only be a few seconds of your life that you won&#39;t regret!!! Thank u to all the people who just give me a chance! :) "
_2viQ_Qnc68Qq98m0mmx4rlprYiD6aYgMb2x3bdupEM,Hidden Love,2013-08-01T09:19:56.654000,Hi. Check out and share our songs.
_2viQ_Qnc698fLCQzZmRt1CqPhf0L6mchwWG5gsUlzk,Hidden Love,2013-07-31T10:22:02.628000,Hi. Check out and share our songs.
_2viQ_Qnc68sxLpsBQ1cPk_LLH91SMsRav51KmhIoQw,Hidden Love,2013-07-30T11:22:57.091000,Hi.Check out and share our songs.
_2viQ_Qnc69Nq0Ytk1jCpzWPCrpGEk6T7cdVAxfSlAk,Shadrach Grentz,2013-07-29T17:39:24.876000,"Hey Music Fans I really appreciate any of you who will take the time to read this, and check my music out! I&#39;m just a 15 year old boy DREAMING of being a successful MUSICIAN in the music world. I do lots of covers, and piano covers. But I don&#39;t have money to advertise. A simple thumbs up to my comment, a comment on my videos or a SUBSCRIPTION would be a step forward! It will only be a few seconds of your life that you won&#39;t regret!!! Thank u to all the people who just give me a chance! :) "
_2viQ_Qnc68wE6_oU558uTupID2DHHu6smRW0Yr5mVs,Anthony Lam,2013-07-29T08:59:24.455000,"Hey, I am doing the Forty Hour famine so I&#39;ll be giving up on food and social working for 40 hours. I&#39;m doing this to raise money for African people who can&#39;t experience the luxuries that we can. So can you donate to give them a chance?  Any amount would do :)  Click on the link and donate h t t p : / / 4 0 h f . c o m . a u / A n t h o n y L a m Thanks :)"
_2viQ_Qnc685qxAXpoMI-8aTnd7plcAbmTrvD_G2Czw,meg fluttershy,2013-07-25T20:47:41.071000,Love itt and ppl check out my channel!!!
_2viQ_Qnc6-F0FnQlt7edQt9rRqV7Clx74E8hyKAVt0,BDOG1040,2013-07-25T05:45:57.646000,SUBSCRIBE MY CHANNEL
_2viQ_Qnc6-Lev7nxVg9RnkxHYNAykFf9lV9qiEIFJY,macgyver16,2013-07-24T14:07:32.431000,adf.ly / KlD3Y
_2viQ_Qnc6_sGHV0-pAXNa1RF9Xja5vmr53ULlzlG3g,macgyver16,2013-07-23T17:00:14.596000,adf.ly / KlD3Y
_2viQ_Qnc6-1oZCLsUWjl3-g4QrWxMQXsSTs2Hy4MGI,damion taylor,2013-07-21T20:20:34.118000,check out my new video
_2viQ_Qnc6_YN7xFNAg14zX99Y614Salf57yOcrBRSw,Shadrach Grentz,2013-07-21T12:21:37.898000,"Hey Music Fans I really appreciate all of you who take time to read this, and check my music out! I&#39;m just a 15 year old boy DREAMING of being a successful MUSICIAN in the music world. I do lots of covers, and piano covers. But I dont have money to advertise. A simple thumbs up to my comment, a comment on my videos or a SUBSCRIPTION would be a step forward! It will only be a few seconds of your life that u won&#39;t regret!!! Thank u to all the people who just give me a chance it means a lot! :)"
_2viQ_Qnc6_fyjM2m-ismUToowpNFauwtldKlfjbtIk,Joshua Kasey,2013-07-21T08:26:18.155000,"Hello everyone, It Is not my intention to spam and am truly sorry If anyone Is annoyed by this but just please hear me out.  I am a rapper, singer, music producer and a song writer and have been making music for a while now, eight years to be exact.  I enjoy making all types of music that anyone can listen to, doesn&#39;t have me talking about killing anyone and most importantly, focuses on the quality of the music.  Please check out my page, It&#39;s only a click away.  Thank you and have a nice day :)"
_2viQ_Qnc6_AXZ4E5CeA3LHE36RAijd3QKgUI-YvjWI,ricky swaggz,2013-07-20T22:09:23.728000,******* Facebook is LAME and so 2004! Check out ------------ swagFriends com Make thousands of cool new friends everyday! Join this new movement!
_2viQ_Qnc68ki9xsFeN2y1_ZiHYcZC8Qv1GyHfwqr7Y,steven reed,2013-07-19T22:12:16.609000,Please check out and send to others Freedom and Justice are on the line!  Please Google:   Steven L. Reed Case Lands in Supreme Court---thanks!
_2viQ_Qnc69mci30y5muwQXNMaeCmIvZ4ca8l_4zPmA,Johnny Rei Vlog,2013-07-19T11:41:54.923000,"Nice to meet You - this is Johnny: 1. If You already know my music - thumb this up, because You found it this way, too. 2. If You want to hear original songs completely made by 1 person, continue reading:  I sing, write original music+lyrics &amp; play guitar, bass, drums &amp; keyboards. I&#39;m a 1-man-band. My music is completely independent &amp; 100% listener-supported. If You want to hear it &amp; if You&#39;re willing to help record new album - click on my name/picture.  Enjoy the music - wish You awesome day!"
_2viQ_Qnc68cxHfQzecR1L9f-hbLNIJ7VxpCZtctPMk,yakikukamo FIRELOVER,2013-07-18T17:07:06.152000,hey you ! check out the channel of Alvar Lake !!
_2viQ_Qnc6-G71VMp3dR76dfQTcrRHpiNXJh2jm8V_M,Johnny Rei Vlog,2013-07-18T16:50:26.909000,"Hi -this is Johnny: 1. If You already know my music - thumb this up, because You found it this way, too. 2. If You want to hear original songs completely made by 1 person, continue reading:  I sing, write original music+lyrics &amp; play guitar, bass, drums &amp; keyboards. I&#39;m a 1-man-band. My music is completely independent &amp; 100% listener-supported. If You want to hear it &amp; if You&#39;re willing to help record new album - click on my name/picture.  Thank You &amp; enjoy the music - wish You awesome day!"
z12xc3ly4x3uttmci22xff24nqqxwb0je04,Lisa Matthews,2013-07-17T13:56:03.233000,Check out this video on YouTube:<br />&quot;This Time for Africa&quot;. One for Trayvon!  And Our MOTHERland<br />Thank-you Shakira﻿
_2viQ_Qnc69GH3FQl348HonbRxpbmtsR5CUei0zkJog,Riley Rollins,2013-07-16T00:30:46.660000,"O peoples of the earth, I have seen how you perform every form of evil at your leisure! You cease not from reveling in that which I hate! Behold, you murder the innocent day and night and plot evil against your neighbor! You stand up for the rights of those who commit abomination and clap your hands as wickedness is celebrated openly in the streets!... O MOST PERVERSE AND ABOMINABLE GENERATION, SHALL I NOT REPAY?!  Hear the Word of The Lord - TrumpetCallOfGodOnline.  co m"
_2viQ_Qnc6-qHJ_u9Yv84vj4yOAPLUL3ZibCc7b-vBI,FAHAD KHAN,2013-07-14T22:06:57.712000,I WILL NEVER FORGET THIS SONG IN MY LIFE LIKE THIS COMMENT OF YOUR HEARING THIS SONG FOR LIKE A YEAR!!!!!
_2viQ_Qnc6_HU65mTzCmXnjA-WLt7XqxqPj7EwAtlO0,ricky swaggz,2013-07-14T20:40:00.331000,********OMG Facebook is OLD! Check out  -----------------&gt; swagFriends com Make thousands of cool new friends everyday! Join the movement!
_2viQ_Qnc6-jk58CPwBnqfbM6oByJH5oPvCtKecLQyo,Shadrach Grentz,2013-07-14T03:11:20.243000,"Hey Music Fans I really appreciate all of you who take time to read this, and check my music out! I&#39;m just a 15 year old boy DREAMING of being a successful MUSICIAN in the music world. I do lots of covers, and piano covers. But I dont have money to advertise. A simple thumbs up to my comment, a comment on my videos or a SUBSCRIPTION would be a step forward! It will only be a few seconds of your life that u won&#39;t regret!!! Thank u to all the people who just give me a chance it means a lot! :)"
_2viQ_Qnc6_fgKR1W7-k1lbVURi8hVbMlQAMSOCSnyk,ThirdDegr3e,2013-07-13T20:48:22.967000,**CHECK OUT MY NEW MIXTAPE**** **CHECK OUT MY NEW MIXTAPE**** **CHECK OUT MY NEW MIXTAPE*** ***CHECK OUT MY NEW MIXTAPE******CHECK OUT MY NEW MIXTAPE**** **CHECK OUT MY NEW MIXTAPE**** **CHECK OUT MY NEW MIXTAPE*** ***CHECK OUT MY NEW MIXTAPE******CHECK OUT MY NEW MIXTAPE**** **CHECK OUT MY NEW MIXTAPE**** **CHECK OUT MY NEW MIXTAPE*** ***CHECK OUT MY NEW MIXTAPE******CHECK OUT MY NEW MIXTAPE**** **CHECK OUT MY NEW MIXTAPE**** **CHECK OUT MY NEW MIXTAPE*** ***CHECK OUT MY NEW MIXTAPE****
_2viQ_Qnc69MEEHHJxZ427KX8MlljJPnUC2YBbvbWwY,ThirdDegr3e,2013-07-13T20:48:06.033000,**CHECK OUT MY NEW MIXTAPE**** **CHECK OUT MY NEW MIXTAPE**** **CHECK OUT MY NEW MIXTAPE*** ***CHECK OUT MY NEW MIXTAPE******CHECK OUT MY NEW MIXTAPE**** **CHECK OUT MY NEW MIXTAPE**** **CHECK OUT MY NEW MIXTAPE*** ***CHECK OUT MY NEW MIXTAPE******CHECK OUT MY NEW MIXTAPE**** **CHECK OUT MY NEW MIXTAPE**** **CHECK OUT MY NEW MIXTAPE*** ***CHECK OUT MY NEW MIXTAPE******CHECK OUT MY NEW MIXTAPE**** **CHECK OUT MY NEW MIXTAPE**** **CHECK OUT MY NEW MIXTAPE*** ***CHECK OUT MY NEW MIXTAPE****
_2viQ_Qnc6_RKHVetk9kLzx8ZC62_J7y73FWFSBTe8Q,ThirdDegr3e,2013-07-13T20:47:40.793000,**CHECK OUT MY NEW MIXTAPE**** **CHECK OUT MY NEW MIXTAPE**** **CHECK OUT MY NEW MIXTAPE*** ***CHECK OUT MY NEW MIXTAPE******CHECK OUT MY NEW MIXTAPE**** **CHECK OUT MY NEW MIXTAPE**** **CHECK OUT MY NEW MIXTAPE*** ***CHECK OUT MY NEW MIXTAPE******CHECK OUT MY NEW MIXTAPE**** **CHECK OUT MY NEW MIXTAPE**** **CHECK OUT MY NEW MIXTAPE*** ***CHECK OUT MY NEW MIXTAPE******CHECK OUT MY NEW MIXTAPE**** **CHECK OUT MY NEW MIXTAPE**** **CHECK OUT MY NEW MIXTAPE*** ***CHECK OUT MY NEW MIXTAPE****
